{
  "schema_version": "1.0",
  "title_id": "PPSA99206",
  "app_id": "io.github.yahballon.ps5-n64x",
  "name": "PS5 N64X",
  "developer": "YAHBALLON",
  "owner": "Yahballon",
  "source_repo": "https://github.com/Yahballon/PS5N64X",
  "status": "registered",
  "created": "2026-10-13",
  "description": "Native PS5 homebrew emulator: PS5 N64X."
}
