{
  "schema_version": "1.0",
  "title_id": "PPSA99573",
  "app_id": "io.github.yahballon.ps5-www-speedtest",
  "name": "WWW Speedtest",
  "developer": "YAHBALLON",
  "owner": "Yahballon",
  "source_repo": "https://github.com/Yahballon/PS5_WWW_SPEEDTEST",
  "status": "registered",
  "created": "2026-10-13",
  "description": "Native PS5 homebrew tool: WWW Speedtest."
}
