{
  "schema_version": "1.0",
  "title_id": "PPSA99338",
  "app_id": "io.github.yahballon.ps5clean",
  "name": "PS5 CLEAN",
  "developer": "YAHBALLON",
  "owner": "Yahballon",
  "source_repo": "https://github.com/Yahballon/PS5CLEAN",
  "status": "registered",
  "created": "2026-10-13",
  "description": "Native PS5 homebrew tool: PS5 CLEAN."
}
