{
  "schema_version": "1.0",
  "title_id": "PPSA99204",
  "app_id": "io.github.yahballon.ps5-nesx",
  "name": "PS5 NESX",
  "developer": "YAHBALLON",
  "owner": "Yahballon",
  "source_repo": "https://github.com/Yahballon/PS5NESX",
  "status": "registered",
  "created": "2026-10-13",
  "description": "Native PS5 homebrew emulator: PS5 NESX."
}
