{
  "schema_version": "1.0",
  "title_id": "PPSA99205",
  "app_id": "io.github.yahballon.ps5-snesx",
  "name": "PS5 SNESX",
  "developer": "YAHBALLON",
  "owner": "Yahballon",
  "source_repo": "https://github.com/Yahballon/PS5SNESX",
  "status": "registered",
  "created": "2026-10-13",
  "description": "Native PS5 homebrew emulator: PS5 SNESX."
}
